Bus Hound 6.01 capture on Windows Vista (x64). Complements of www.perisoft.net

  Device - Device ID (followed by the endpoint for USB devices)
            (31) OpenMV Cam USB COM Port (COM8)
  Phase  - Phase Type
            IN    Data in transfer           
            OUT   Data out transfer          
  Data   - Hex dump of the data transferred
  Descr  - Description of the phase
  Cmd... - Position in the captured data


Device  Phase  Data                                                Description       Cmd.Phase.Ofs(rep)
------  -----  --------------------------------------------------  ----------------  ------------------
  31    OUT    30 8e 04 00  00 00                                  0.....                   1.1.0(2)     
  31    IN     00 00 00 00                                         ....                     2.1.0(2)     
  31    OUT    30 81 0c 00  00 00                                  0.....                   3.1.0(2)     
  31    IN     00 00 00 00  20 74 69 6d  65 3d 30 2e               .... time=0.             4.1.0(2)     
  31    OUT    30 8e 04 00  00 00                                  0.....                   9.1.0        
  31    IN     00 00 00 00                                         ....                    10.1.0        
  31    OUT    30 81 0c 00  00 00                                  0.....                  11.1.0        
  31    IN     40 01 00 00  f0 00 00 00  84 0d 00 00               @...........            12.1.0        
  31    OUT    30 82 84 0d  00 00                                  0.....                  13.1.0        
  31    IN     ff d8 ff e0  00 10 4a 46  49 46 00 01  01 00 00 01  ......JFIF......        14.1.0        
               00 01 00 00  ff db 00 84  00 17 10 11  14 11 0e 17  ................        14.1.16       
               14 12 14 1a  18 17 1b 22  39 25 22 1f  1f 22 46 32  ......."9%".."F2        14.1.32       
               35 29 39 52  48 57 55 51  48 50 4e 5b  66 83 6f 5b  5)9RHWUQHPN[f.o[        14.1.48       
  31    IN     6a 73 74 75  76 77 78 79  7a 82 83 84  85 86 87 88  jstuvwxyz.......        15.1.0        
               89 8a 92 93  94 95 96 97  98 99 9a a2  a3 a4 a5 a6  ................        15.1.16       
               a7 a8 a9 aa  b2 b3 b4 b5  b6 b7 b8 b9  ba c2 c3 c4  ................        15.1.32       
               c5 c6 c7 c8  c9 ca d2 d3  d4 d5 d6 d7  d8 d9 da e2  ................        15.1.48       
  31    IN     ed 54 99 19  49 0e 00 20  f3 e9 9f eb  8a 00 67 ae  .T..I.. ......g.        16.1.0        
               31 ef e9 9e  e7 de 80 3a  70 71 d8 77  c7 61 8e d4  1......:pq.w.a..        16.1.16       
               74 23 ae 7b  7a e3 b0 f6  cd 28 ee 78  ef bb 9f 97  t#..z....(.x....        16.1.32       
               3d c9 3d e9  00 a3 b9 cf  ae ee 78 f7  39 a4 c7 03  =.=.......x.9...        16.1.48       
  31    IN     40 0d 53 91  4f 02 99 8d  a7 22 9e a7  22 80 16 96  @.S.O....".."...        17.1.0        
               92 94 50 01  4a 29 68 a0  02 8a 28 a0  02 8a 09 c5  ..P.J)h...(.....        17.1.16       
               00 13 40 08  79 e0 52 63  69 e6 a4 03  14 63 34 00  ..@.y.Rci....c4.        17.1.32       
               0c 1e 94 b4  ce 54 fb 53  c1 cd 00 2d  14 52 d0 01  .....T.S...-.R..        17.1.48       
  31    IN     18 cb dc 52  a9 cd 3c 0e  29 8c b8 39  14 00 fe 94  ...R..<.)..9....        18.1.0        
               52 29 c8 a5  a0 05 a2 8a  28 00 a5 a4  a5 a0 02 96  R)......(.......        18.1.16       
               92 96 81 85  2d 25 21 3e  94 08 76 71  49 b4 91 c5  ....-%!>..vqI...        18.1.32       
               0a b9 e4 d4  82 98 17 62  91 0c 60 a8  c7 6c 54 95  .......b..`..lT.        18.1.48       
  31    IN     a2 8a 28 00  a2 8a 09 c5  00 14 c6 e7  a5 29 cb 53  ..(..........).S        19.1.0        
               80 c5 00 31  78 3c d3 e9  19 73 48 a7  b1 a0 07 52  ...1x<...sH....R        19.1.16       
               e6 92 94 50  02 d1 45 14  00 51 45 14  00 b4 52 66  ...P..E..QE...Rf        19.1.32       
               8a 00 51 4b  9a 6d 14 c0  7e 6a 48 27  31 b8 52 49  ..QK.m...jH'1.RI        19.1.48       
  31    IN     eb 40 1d cd  3a 80 0a 28  a2 98 05 2d  25 14 00 b4  .@..:..(...-%...        20.1.0        
               51 45 20 0a  5a 4a 51 4c  06 9f 94 f1  4e 07 34 63  QE .ZJQL....N.4c        20.1.16       
               34 df ba 69  00 51 4e c5  18 a6 48 c2  31 4e 02 97  4..i.QN...H.1N..        20.1.32       
               14 aa 29 88  4c 53 80 a5  02 94 0a 00  40 29 c0 53  ..).LS......@).S        20.1.48       
  31    OUT    30 8e 04 00  00 00                                  0.....                  21.1.0(2)     
  31    IN     00 00 00 00                                         ....                    22.1.0(2)     
  31    OUT    30 81 0c 00  00 00                                  0.....                  23.1.0(2)     
  31    IN     00 00 00 00  a9 00 64 b5  38 0c 50 06               ......d.8.P.            24.1.0(2)     
  31    OUT    30 8e 04 00  00 00                                  0.....                  29.1.0        
  31    IN     00 00 00 00                                         ....                    30.1.0        
  31    OUT    30 87 04 00  00 00                                  0.....                  31.1.0        
  31    IN     01 00 00 00                                         ....                    32.1.0        
  31    OUT    30 81 0c 00  00 00                                  0.....                  33.1.0        
  31    IN     00 00 00 00  a9 00 64 b5  38 0c 50 06               ......d.8.P.            34.1.0        
  31    OUT    30 8e 04 00  00 00                                  0.....                  35.1.0        
  31    IN     0f 00 00 00                                         ....                    36.1.0        
  31    OUT    30 8f 0f 00  00 00                                  0.....                  37.1.0        
  31    IN     66 69 6e 64  20 74 69 6d  65 3d 30 2e  30 0d 0a     find time=0.0..         38.1.0        
  31    OUT    30 81 0c 00  00 00                                  0.....                  39.1.0(2)     
  31    IN     00 00 00 00  20 74 69 6d  65 3d 30 2e               .... time=0.            40.1.0(2)     
  31    OUT    30 8e 04 00  00 00                                  0.....                  41.1.0(2)     
  31    IN     00 00 00 00                                         ....                    42.1.0(2)     
  31    OUT    30 81 0c 00  00 00                                  0.....                  47.1.0        
  31    IN     40 01 00 00  f0 00 00 00  7e 0d 00 00               @...........            48.1.0        
  31    OUT    30 82 7e 0d  00 00                                  0.....                  49.1.0        
  31    IN     ff d8 ff e0  00 10 4a 46  49 46 00 01  01 00 00 01  ......JFIF......        50.1.0        
               00 01 00 00  ff db 00 84  00 17 10 11  14 11 0e 17  ................        50.1.16       
               14 12 14 1a  18 17 1b 22  39 25 22 1f  1f 22 46 32  ......."9%".."F2        50.1.32       
               35 29 39 52  48 57 55 51  48 50 4e 5b  66 83 6f 5b  5)9RHWUQHPN[f.o[        50.1.48       
  31    IN     6a 73 74 75  76 77 78 79  7a 82 83 84  85 86 87 88  jstuvwxyz.......        51.1.0        
               89 8a 92 93  94 95 96 97  98 99 9a a2  a3 a4 a5 a6  ................        51.1.16       
               a7 a8 a9 aa  b2 b3 b4 b5  b6 b7 b8 b9  ba c2 c3 c4  ................        51.1.32       
               c5 c6 c7 c8  c9 ca d2 d3  d4 d5 d6 d7  d8 d9 da e2  ................        51.1.48       
  31    IN     07 9f 4c ff  00 5c 50 04  7e b8 20 7a  fa 67 b9 f7  ..L..\P... z.g..        52.1.0        
               c5 28 1d 38  38 ec 31 ce  3b 0c 76 a3  18 23 ae 71  .(.88.1.;.v..#.q        52.1.16       
               c7 ae 3b 0f  6c d2 8e 73  d3 b9 6e 7e  5f 72 4f 7a  ..;.l..s..n._rOz        52.1.32       
               04 1e bd 3b  ee e7 8c f7  24 d2 e3 a7  1f 29 e8 08  ...;....$....)..        52.1.48       
  31    IN     9d 8a 69 1b  4e 45 3c 1c  8a 00 29 68  a5 a0 00 0a  ..i.NE<...)h....        53.1.0        
               5a 28 a0 02  8a 29 45 00  18 a5 c0 14  84 81 49 82  Z(...)E.......I.        53.1.16       
               68 00 3c f0  29 31 b4 f3  4f 03 14 b8  cd 00 20 a7  h.<.)1..O..... .        53.1.32       
               0a 66 36 fd  29 ea 72 28  00 a5 a2 96  80 0a 28 14  .f6.).r(......(.        53.1.48       
  31    IN     d6 5e e2 95  1b 34 ea 6b  2e 0e 45 00  3a 96 9a a7  .^...4.k..E.:...        54.1.0        
               22 9d 40 05  14 51 40 0b  4a 29 05 28  a0 02 8a 28  ".@..Q@.J).(...(        54.1.16       
               a0 05 a2 8a  42 d4 00 e2  c0 53 70 48  e2 95 57 b9  ....B....SpH..W.        54.1.32       
               a7 8a 68 0b  b1 48 86 31  b0 63 da a4  aa 48 4a b8  ..h..H.1.c...HJ.        54.1.48       
  31    IN     28 a0 9c 50  01 4c 6e 69  72 4d 38 0c  50 03 17 83  (..P.LnirM8.P...        55.1.0        
               cd 49 4d 61  9a 45 3d 8d  00 3f a5 14  94 bd 68 01  .IMa.E=..?....h.        55.1.16       
               68 a4 a5 a0  02 8a 28 a0  05 a2 93 34  50 02 8a 5c  h.....(....4P..\        55.1.32       
               d3 68 a6 03  f3 52 43 39  8d c2 92 4a  1e 31 ef 50  .h...RC9...J.1.P        55.1.48       
  31    IN     4b 40 05 14  51 4c 02 96  92 8a 00 5a  5a 4a 5a 40  K@..QL.....ZZJZ@        56.1.0        
               34 8d a7 34  e1 cd 18 a6  e7 69 a0 04  a5 c5 2e 28  4..4.....i.....(        56.1.16       
               c5 32 46 91  cd 38 0a 5c  50 05 00 18  a5 02 94 0a  .2F..8.\P.......        56.1.32       
               50 29 80 80  53 80 a7 05  a7 01 8a 62  1a 16 94 29  P)..S......b...)        56.1.48       
  31    OUT    30 8e 04 00  00 00                                  0.....                  57.1.0        
  31    IN     00 00 00 00                                         ....                    58.1.0        
  31    OUT    30 81 0c 00  00 00                                  0.....                  59.1.0        
  31    IN     00 00 00 00  14 01 8a 5a  00 28 a4 a5               .......Z.(..            60.1.0        
  31    OUT    30 8e 04 00  00 00                                  0.....                  61.1.0        
  31    IN     00 00 00 00                                         ....                    62.1.0        
  31    IN     00 00 00 00  14 01 8a 5a  00 28 a4 a5               .......Z.(..            63.1.0        
  31    OUT    30 81 0c 00  00 00                                  0.....                  64.1.0        
  31    OUT    30 8e 04 00  00 00                                  0.....                  65.1.0        
  31    IN     00 00 00 00                                         ....                    66.1.0        
  31    OUT    30 81 0c 00  00 00                                  0.....                  67.1.0        
  31    IN     00 00 00 00  14 01 8a 5a  00 28 a4 a5               .......Z.(..            68.1.0        
  31    OUT    30 8e 04 00  00 00                                  0.....                  69.1.0        
  31    IN     0f 00 00 00                                         ....                    70.1.0        
  31    OUT    30 8f 0f 00  00 00                                  0.....                  71.1.0        
  31    IN     66 69 6e 64  20 74 69 6d  65 3d 30 2e  30 0d 0a     find time=0.0..         72.1.0        
  31    OUT    30 81 0c 00  00 00                                  0.....                  73.1.0(2)     
  31    IN     00 00 00 00  20 74 69 6d  65 3d 30 2e               .... time=0.            74.1.0(2)     
  31    OUT    30 8e 04 00  00 00                                  0.....                  75.1.0(2)     
  31    IN     00 00 00 00                                         ....                    76.1.0(2)     
  31    OUT    30 81 0c 00  00 00                                  0.....                  81.1.0        
  31    IN     40 01 00 00  f0 00 00 00  6d 0d 00 00               @.......m...            82.1.0        
  31    OUT    30 82 6d 0d  00 00                                  0.m...                  83.1.0        
  31    IN     ff d8 ff e0  00 10 4a 46  49 46 00 01  01 00 00 01  ......JFIF......        84.1.0        
               00 01 00 00  ff db 00 84  00 17 10 11  14 11 0e 17  ................        84.1.16       
               14 12 14 1a  18 17 1b 22  39 25 22 1f  1f 22 46 32  ......."9%".."F2        84.1.32       
               35 29 39 52  48 57 55 51  48 50 4e 5b  66 83 6f 5b  5)9RHWUQHPN[f.o[        84.1.48       
  31    IN     6a 73 74 75  76 77 78 79  7a 82 83 84  85 86 87 88  jstuvwxyz.......        85.1.0        
               89 8a 92 93  94 95 96 97  98 99 9a a2  a3 a4 a5 a6  ................        85.1.16       
               a7 a8 a9 aa  b2 b3 b4 b5  b6 b7 b8 b9  ba c2 c3 c4  ................        85.1.32       
               c5 c6 c7 c8  c9 ca d2 d3  d4 d5 d6 d7  d8 d9 da e2  ................        85.1.48       
  31    IN     c0 c8 3c fa  67 fa e2 80  19 ea 46 3d  fd 33 dc fb  ..<.g.....F=.3..        86.1.0        
               d1 81 c7 07  b6 06 39 c7  61 8e d4 bd  08 c6 7a 71  ......9.a.....zq        86.1.16       
               eb 8f 4f 6c  d0 39 cf 4f  56 e7 e5 f7  24 f7 a0 05  ..Ol.9.OV...$...        86.1.32       
               ec 48 23 be  ee 78 f7 24  d1 8e 9c 1c  1e 80 8e 47  .H#..x.$.......G        86.1.48       
  31    IN     07 22 9c a7  22 80 16 96  8a 51 d2 80  10 0a 75 14  .".."....Q....u.        87.1.0        
               50 01 45 14  b4 00 51 46  69 00 26 80  03 cf 14 98  P.E...QFi.&.....        87.1.16       
               da 79 a7 81  8a 5c 66 80  10 52 d3 71  b7 e9 4f 5e  .y...\f..R.q..O^        87.1.32       
               68 00 02 96  8a 5a 00 28  a2 96 98 00  a5 a2 94 53  h....Z.(.......S        87.1.48       
  31    IN     2d 00 14 51  4a 28 01 45  14 51 40 05  2d 25 2d 00  -..QJ(.E.Q@.-%-.        88.1.0        
               14 a2 92 90  b6 3a 53 01  c4 81 49 b4  91 c5 0a b9  .....:S...I.....        88.1.16       
               e4 d4 82 98  8b 91 3a 34  63 67 03 d3  d2 a4 aa 71  ......:4cg.....q        88.1.32       
               92 ac 08 fc  6a da 90 c3  22 93 04 2d  14 51 48 61  ....j..."..-.QHa        88.1.48       
  31    IN     eb cd 49 4d  65 ef 48 ad  d8 d0 03 e8  a2 8a 00 29  ..IMe.H........)        89.1.0        
               69 29 68 00  a2 8a 29 80  b4 52 51 40  0a 0d 2e 69  i)h...)..RQ@...i        89.1.16       
               b4 66 80 1f  9a 92 19 cc  6e 14 e7 69  e3 15 06 69  .f......n..i...i        89.1.32       
               ac 78 c5 00  5f b8 b8 58  d7 6a 90 58  fe 95 4c 54  .x.._..X.j.X..LT        89.1.48       
  31    IN     a0 06 9f 94  e4 53 c1 a3  19 a6 67 69  a4 01 8a 5c  .....S....gi...\        90.1.0        
               52 e2 8c 53  24 69 18 a7  0a 31 4a 05  30 0c 52 81  R..S$i...1J.0.R.        90.1.16       
               4a 05 38 0a  04 20 14 a0  53 82 d3 80  c5 30 1a 16  J.8.. ..S....0..        90.1.32       
               94 21 63 80  33 52 24 65  fa 74 f5 ab  28 81 06 00  .!c.3R$e.t..(...        90.1.48       
  31    OUT    30 8e 04 00  00 00                                  0.....                  91.1.0(3)     
  31    IN     00 00 00 00                                         ....                    92.1.0(3)     
  31    OUT    30 81 0c 00  00 00                                  0.....                  93.1.0(3)     
  31    IN     00 00 00 00  2e 68 01 d4  53 15 bb 1a               .....h..S...            94.1.0(3)     
  31    OUT    30 8e 04 00  00 00                                  0.....                 103.1.0        
  31    IN     0f 00 00 00                                         ....                   104.1.0        
  31    OUT    30 8f 0f 00  00 00                                  0.....                 105.1.0        
  31    IN     66 69 6e 64  20 74 69 6d  65 3d 30 2e  30 0d 0a     find time=0.0..        106.1.0        
  31    OUT    30 81 0c 00  00 00                                  0.....                 107.1.0        
  31    IN     00 00 00 00  20 74 69 6d  65 3d 30 2e               .... time=0.           108.1.0        
  31    OUT    30 87 04 00  00 00                                  0.....                 109.1.0        
  31    IN     01 00 00 00                                         ....                   110.1.0        
  31    OUT    30 8e 04 00  00 00                                  0.....                 111.1.0(2)     
  31    IN     00 00 00 00                                         ....                   112.1.0(2)     
  31    OUT    30 81 0c 00  00 00                                  0.....                 113.1.0(2)     
  31    IN     00 00 00 00  20 74 69 6d  65 3d 30 2e               .... time=0.           114.1.0(2)     
  31    OUT    30 8e 04 00  00 00                                  0.....                 119.1.0        
  31    IN     00 00 00 00                                         ....                   120.1.0        
  31    OUT    30 81 0c 00  00 00                                  0.....                 121.1.0        
  31    IN     40 01 00 00  f0 00 00 00  6f 0d 00 00               @.......o...           122.1.0        
  31    OUT    30 82 6f 0d  00 00                                  0.o...                 123.1.0        
  31    IN     ff d8 ff e0  00 10 4a 46  49 46 00 01  01 00 00 01  ......JFIF......       124.1.0        
               00 01 00 00  ff db 00 84  00 17 10 11  14 11 0e 17  ................       124.1.16       
               14 12 14 1a  18 17 1b 22  39 25 22 1f  1f 22 46 32  ......."9%".."F2       124.1.32       
               35 29 39 52  48 57 55 51  48 50 4e 5b  66 83 6f 5b  5)9RHWUQHPN[f.o[       124.1.48       
  31    IN     6a 73 74 75  76 77 78 79  7a 82 83 84  85 86 87 88  jstuvwxyz.......       125.1.0        
               89 8a 92 93  94 95 96 97  98 99 9a a2  a3 a4 a5 a6  ................       125.1.16       
               a7 a8 a9 aa  b2 b3 b4 b5  b6 b7 b8 b9  ba c2 c3 c4  ................       125.1.32       
               c5 c6 c7 c8  c9 ca d2 d3  d4 d5 d6 d7  d8 d9 da e2  ................       125.1.48       
  31    IN     d5 49 90 a9  21 c7 23 ae  7a 67 fa e2  80 b8 cf 52  .I..!.#.zg.....R       126.1.0        
               08 1e be 99  ee 7d e8 c7  43 cf b0 c7  38 ec 31 da  ........C...8.1.       126.1.16       
               8e 01 1d 73  8e 3d 71 e9  ed 9a 51 df  a7 72 dc fc  ...s.=q...Q..r..       126.1.32       
               be e4 9e f4  00 74 c9 07  d7 77 3c 7b  92 69 71 d3  .....t...w<..iq.       126.1.48       
  31    IN     01 aa 72 29  e0 53 31 b7  91 4f 07 22  80 16 96 92  ..r).S1..O."....       127.1.0        
               96 80 0a 50  28 a5 a0 02  8a 28 a0 02  8a 33 49 82  ...P(....(...3I.       127.1.16       
               68 00 3c f0  29 31 83 cd  3c 0c 52 e3  34 00 0f 6a  h.<.)1..<.R.4..j       127.1.32       
               5a 66 0a 9f  6a 78 39 a0  05 14 51 4a  28 18 51 4b  Zf..jx9...QJ(.QK       127.1.48       
  31    IN     8a 00 92 8a  6a 9c 8a 75  00 14 51 45  00 14 b8 a2  ....j..u..QE....       128.1.0        
               96 80 0a 28  a2 80 0a 5a  4a 42 68 01  c4 e2 93 69  ...(...ZJBh....i       128.1.16       
               23 8a 14 77  35 20 a6 05  d8 a4 43 18  d8 31 ed 52  #..w5 ....C..1.R       128.1.32       
               55 18 c9 47  04 71 eb 57  55 83 00 47  7a 18 0b 45  U..G.q.WU..Gz..E       128.1.48       
  31    IN     18 bc 1c 1a  97 e9 4c 65  a1 5b b1 a0  07 d1 49 4b  ......Le.[....IK       129.1.0        
               40 05 14 51  40 05 2d 25  14 00 b4 52  51 4c 07 0a  @..Q@.-%...RQL..       129.1.16       
               5c d3 68 a0  07 e6 9f 0c  c6 37 0a 49  2a 78 c7 bd  \.h......7.I*x..       129.1.32       
               43 4d 63 da  80 2f dc 5c  2c 6b b5 48  2c 7f 4a a4  CMc../.\,k.H,.J.       129.1.48       
  31    IN     0d 3c 1c 8a  78 e6 8c 66  99 f7 4d 00  18 a3 14 ec  .<..x..f..M.....       130.1.0        
               51 8a 09 1b  8c 1a 70 14  b8 a0 0c 53  10 62 94 0a  Q.....p....S.b..       130.1.16       
               5c 53 80 a6  02 01 4a 05  38 2d 38 0a  00 68 5a 70  \S....J.8-8..hZp       130.1.32       
               52 c7 00 66  a4 48 cb f4  e9 eb 56 11  02 0c 01 4d  R..f.H....V....M       130.1.48       
  31    OUT    30 8e 04 00  00 00                                  0.....                 131.1.0(2)     
  31    IN     00 00 00 00                                         ....                   132.1.0(2)     
  31    OUT    30 81 0c 00  00 00                                  0.....                 133.1.0(2)     
  31    IN     00 00 00 00  ac b9 a6 03  a9 69 8a dd               .........i..           134.1.0(2)     
  31    OUT    30 8e 04 00  00 00                                  0.....                 139.1.0        
  31    IN     0f 00 00 00                                         ....                   140.1.0        
  31    OUT    30 8f 0f 00  00 00                                  0.....                 141.1.0        
  31    IN     66 69 6e 64  20 74 69 6d  65 3d 30 2e  30 0d 0a     find time=0.0..        142.1.0        
  31    OUT    30 81 0c 00  00 00                                  0.....                 143.1.0        
  31    IN     00 00 00 00  20 74 69 6d  65 3d 30 2e               .... time=0.           144.1.0        
  31    IN     00 00 00 00                                         ....                   145.1.0        
  31    OUT    30 8e 04 00  00 00                                  0.....                 146.1.0        
  31    OUT    30 81 0c 00  00 00                                  0.....                 147.1.0(2)     
  31    IN     00 00 00 00  20 74 69 6d  65 3d 30 2e               .... time=0.           148.1.0(2)     
  31    OUT    30 8e 04 00  00 00                                  0.....                 149.1.0(2)     
  31    IN     00 00 00 00                                         ....                   150.1.0(2)     
  31    OUT    30 81 0c 00  00 00                                  0.....                 155.1.0        
  31    IN     40 01 00 00  f0 00 00 00  6e 0d 00 00               @.......n...           156.1.0        
  31    OUT    30 82 6e 0d  00 00                                  0.n...                 157.1.0        
  31    IN     ff d8 ff e0  00 10 4a 46  49 46 00 01  01 00 00 01  ......JFIF......       158.1.0        
               00 01 00 00  ff db 00 84  00 17 10 11  14 11 0e 17  ................       158.1.16       
               14 12 14 1a  18 17 1b 22  39 25 22 1f  1f 22 46 32  ......."9%".."F2       158.1.32       
               35 29 39 52  48 57 55 51  48 50 4e 5b  66 83 6f 5b  5)9RHWUQHPN[f.o[       158.1.48       
  31    IN     6a 73 74 75  76 77 78 79  7a 82 83 84  85 86 87 88  jstuvwxyz.......       159.1.0        
               89 8a 92 93  94 95 96 97  98 99 9a a2  a3 a4 a5 a6  ................       159.1.16       
               a7 a8 a9 aa  b2 b3 b4 b5  b6 b7 b8 b9  ba c2 c3 c4  ................       159.1.32       
               c5 c6 c7 c8  c9 ca d2 d3  d4 d5 d6 d7  d8 d9 da e2  ................       159.1.48       
  31    IN     29 21 c0 07  3c fa 67 fa  e2 80 ea 37  d4 8f c7 d3  )!..<.g....7....       160.1.0        
               3d cf be 28  c7 4c 03 8e  30 31 ce 3b  0c 76 a3 18  =..(.L..01.;.v..       160.1.16       
               23 af 4e 3d  71 e9 ed 9a  07 39 e9 fe  d7 3f 2f b9  #.N=q....9...?/.       160.1.32       
               27 bd 00 2f  ae 08 ff 00  6b 9e 3d c9  34 7a 71 f2  '../....k.=.4zq.       160.1.48       
  31    IN     23 1c 8a 78  39 14 00 b4  b4 94 a2 80  00 29 69 68  #..x9........)ih       161.1.0        
               a0 02 8a 28  a0 02 8a 09  c5 18 26 80  10 f3 c0 a3  ...(......&.....       161.1.16       
               1b 4f 34 f0  31 46 33 40  00 f6 a5 a6  e3 69 f6 a7  .O4.1F3@.....i..       161.1.32       
               03 9a 00 5a  51 49 4b 40  05 2d 14 53  00 a5 02 81  ...ZQIK@.-.S....       161.1.48       
  31    IN     91 4e a0 02  8a 28 a0 02  96 92 97 14  00 52 d1 45  .N...(.......R.E       162.1.0        
               00 2d 02 92  90 9f 4a 00  71 60 29 36  92 38 a1 57  .-....J.q`)6.8.W       162.1.16       
               b9 a9 05 30  2e c5 22 18  c6 c1 8f 6c  54 95 45 09  ...0.."....lT.E.       162.1.32       
               47 04 1c 7a  d5 d5 60 c0  11 de 86 02  d1 45 14 80  G..z..`......E..       162.1.48       
  31    IN     80 05 00 35  7a e0 d4 94  d6 5c d2 29  ec 68 01 f4  ...5z....\.).h..       163.1.0        
               66 92 94 50  02 d1 49 4a  28 00 a2 8a  28 00 a2 8c  f..P..IJ(...(...       163.1.16       
               d1 40 0a 29  73 4d a2 98  0f cd 49 04  e6 37 0a 49  .@.)sM....I..7.I       163.1.32       
               28 78 c5 41  9a 6b 1e 31  40 1a 17 17  0b 1a ed 52  (x.A.k.1@......R       163.1.48       
  31    IN     fc a7 22 9e  39 a3 14 df  ba 68 00 a2  97 14 62 99  ..".9....h....b.       164.1.0        
               23 4f 14 e1  4b 8c d0 06  28 00 c5 28  14 a0 53 80  #O..K...(..(..S.       164.1.16       
               a6 02 01 4a  05 38 2d 38  0a 62 1a 16  94 29 63 80  ...J.8-8.b...)c.       164.1.32       
               32 6a 44 8d  9f a7 4f 5a  b5 1c 6b 18  c0 1f 8d 1b  2jD...OZ..k.....       164.1.48       
  31    OUT    30 8e 04 00  00 00                                  0.....                 165.1.0(3)     
  31    IN     00 00 00 00                                         ....                   166.1.0(3)     
  31    OUT    30 81 0c 00  00 00                                  0.....                 167.1.0(3)     
  31    IN     00 00 00 00  35 97 34 00  ea 29 8a dd               ....5.4..)..           168.1.0(3)     
  31    OUT    30 8e 04 00  00 00                                  0.....                 177.1.0        
  31    IN     0f 00 00 00                                         ....                   178.1.0        
  31    OUT    30 8f 0f 00  00 00                                  0.....                 179.1.0        
  31    IN     66 69 6e 64  20 74 69 6d  65 3d 30 2e  30 0d 0a     find time=0.0..        180.1.0        
  31    OUT    30 81 0c 00  00 00                                  0.....                 181.1.0        
  31    IN     00 00 00 00  20 74 69 6d  65 3d 30 2e               .... time=0.           182.1.0        
  31    IN     00 00 00 00                                         ....                   183.1.0        
  31    OUT    30 8e 04 00  00 00                                  0.....                 184.1.0        
  31    OUT    30 87 04 00  00 00                                  0.....                 185.1.0        
  31    IN     01 00 00 00                                         ....                   186.1.0        
  31    OUT    30 81 0c 00  00 00                                  0.....                 187.1.0        
  31    IN     00 00 00 00  20 74 69 6d  65 3d 30 2e               .... time=0.           188.1.0        
  31    OUT    30 8e 04 00  00 00                                  0.....                 189.1.0        
  31    IN     00 00 00 00                                         ....                   190.1.0        
  31    OUT    30 81 0c 00  00 00                                  0.....                 191.1.0        
  31    IN     40 01 00 00  f0 00 00 00  6f 0d 00 00               @.......o...           192.1.0        
  31    OUT    30 82 6f 0d  00 00                                  0.o...                 193.1.0        
  31    IN     ff d8 ff e0  00 10 4a 46  49 46 00 01  01 00 00 01  ......JFIF......       194.1.0        
               00 01 00 00  ff db 00 84  00 17 10 11  14 11 0e 17  ................       194.1.16       
               14 12 14 1a  18 17 1b 22  39 25 22 1f  1f 22 46 32  ......."9%".."F2       194.1.32       
               35 29 39 52  48 57 55 51  48 50 4e 5b  66 83 6f 5b  5)9RHWUQHPN[f.o[       194.1.48       
  31    IN     6a 73 74 75  76 77 78 79  7a 82 83 84  85 86 87 88  jstuvwxyz.......       195.1.0        
               89 8a 92 93  94 95 96 97  98 99 9a a2  a3 a4 a5 a6  ................       195.1.16       
               a7 a8 a9 aa  b2 b3 b4 b5  b6 b7 b8 b9  ba c2 c3 c4  ................       195.1.32       
               c5 c6 c7 c8  c9 ca d2 d3  d4 d5 d6 d7  d8 d9 da e2  ................       195.1.48       
  31    IN     24 30 c1 07  9f 4c ff 00  5c 50 1d 46  f3 c9 04 7b  $0...L..\P.F....       196.1.0        
               fa 67 b9 f7  a0 0e 9c 1c  76 18 e7 1d  86 3b 51 d0  .g......v....;Q.       196.1.16       
               8e bd 38 f5  c7 a7 b6 69  47 7e 9d f7  73 f2 fb 92  ..8....iG...s...       196.1.32       
               7b d1 60 0f  52 08 ef bb  9e 3d c9 34  63 a7 1f 2f  ..`.R....=.4c../       196.1.48       
  31    IN     4e 14 d2 30  72 29 e0 e4  50 01 4b 45  28 14 00 01  N..0r)..P.KE(...       197.1.0        
               4b 45 14 00  51 45 28 14  00 52 f4 a4  24 52 60 9a  KE..QE(..R..$R`.       197.1.16       
               00 0f 3c 0a  4c 6d 3c d3  c0 c5 2e 33  40 00 a5 a6  ..<.Lm<....3@...       197.1.32       
               63 6d 3d 48  34 c0 5c 51  45 2d 00 14  51 4b 40 00  cm=H4.\QE-..QK@.       197.1.48       
  31    IN     14 b4 94 a2  80 14 51 45  14 00 52 d2  52 d0 01 4a  ......QE..R.R..J       198.1.0        
               29 29 0b 76  a6 03 89 c5  26 d2 45 0a  b9 e4 d4 8b  )).v....&.E.....       198.1.16       
               4c 0b 91 48  8d 18 d8 30  3d 3d 2a 4a  a6 84 ab 02  L..H...0==*J....       198.1.32       
               38 f5 ab 6a  43 0c 8a 4c  48 5a 28 a2  90 c2 8a 28  8..jC..LHZ(....(       198.1.48       
  31    IN     1e 6a 4a 6b  2f a5 22 b7  63 40 0f a2  8c d1 40 05  .jJk/.".c@....@.       199.1.0        
               14 51 40 05  2d 25 14 00  b4 52 52 d3  01 41 a5 cd  .Q@.-%...RR..A..       199.1.16       
               36 8a 00 7e  6a 48 66 31  b8 53 92 a7  8c 54 19 a6  6...jHf1.S...T..       199.1.32       
               b1 18 c5 00  5f b8 b8 58  d7 6a 90 58  fe 95 4a a3  ...._..X.j.X..J.       199.1.48       
  31    IN     8a 28 a0 06  9f 97 9a 70  e6 8c 66 9b  f7 4d 00 18  .(.....p..f..M..       200.1.0        
               a2 97 14 b8  a6 48 c3 c5  38 52 e2 80  28 00 a5 02  .....H..8R..(...       200.1.16       
               94 0a 70 14  c0 40 29 c0  52 85 a7 01  4c 06 85 a5  ..p..@).R...L...       200.1.32       
               0a 58 e0 0c  d4 a9 1b 3f  4e 9e b5 65  23 54 18 03  .X.....?N..e#T..       200.1.48       
  31    OUT    30 8e 04 00  00 00                                  0.....                 201.1.0(3)     
  31    IN     00 00 00 00                                         ....                   202.1.0(3)     
  31    OUT    30 81 0c 00  00 00                                  0.....                 203.1.0(3)     
  31    IN     00 00 00 00  a6 b2 e6 80  1d 45 31 5b               .........E1[           204.1.0(3)     
  31    OUT    30 8e 04 00  00 00                                  0.....                 213.1.0        
  31    IN     0f 00 00 00                                         ....                   214.1.0        
  31    OUT    30 8f 0f 00  00 00                                  0.....                 215.1.0        
  31    IN     66 69 6e 64  20 74 69 6d  65 3d 30 2e  30 0d 0a     find time=0.0..        216.1.0        
  31    OUT    30 81 0c 00  00 00                                  0.....                 217.1.0(3)     
  31    IN     00 00 00 00  20 74 69 6d  65 3d 30 2e               .... time=0.           218.1.0(3)     
  31    OUT    30 8e 04 00  00 00                                  0.....                 219.1.0(3)     
  31    IN     00 00 00 00                                         ....                   220.1.0(3)     
  31    OUT    30 81 0c 00  00 00                                  0.....                 229.1.0        
  31    IN     40 01 00 00  f0 00 00 00  77 0d 00 00               @.......w...           230.1.0        
  31    OUT    30 82 77 0d  00 00                                  0.w...                 231.1.0        
  31    IN     ff d8 ff e0  00 10 4a 46  49 46 00 01  01 00 00 01  ......JFIF......       232.1.0        
               00 01 00 00  ff db 00 84  00 17 10 11  14 11 0e 17  ................       232.1.16       
               14 12 14 1a  18 17 1b 22  39 25 22 1f  1f 22 46 32  ......."9%".."F2       232.1.32       
               35 29 39 52  48 57 55 51  48 50 4e 5b  66 83 6f 5b  5)9RHWUQHPN[f.o[       232.1.48       
  31    IN     6a 73 74 75  76 77 78 79  7a 82 83 84  85 86 87 88  jstuvwxyz.......       233.1.0        
               89 8a 92 93  94 95 96 97  98 99 9a a2  a3 a4 a5 a6  ................       233.1.16       
               a7 a8 a9 aa  b2 b3 b4 b5  b6 b7 b8 b9  ba c2 c3 c4  ................       233.1.32       
               c5 c6 c7 c8  c9 ca d2 d3  d4 d5 d6 d7  d8 d9 da e2  ................       233.1.48       
  31    IN     3c fa 67 fa  e2 80 18 3b  e0 8c f7 f4  cf 73 ef 8a  <.g....;.....s..       234.1.0        
               00 e9 d7 1d  86 39 c7 61  8a 08 c1 1d  7a 71 8e b8  .....9.a....zq..       234.1.16       
               f4 f6 cd 28  cf 3d 3b ee  c7 dd f7 24  f7 a0 00 74  ...(.=;....$...t       234.1.32       
               24 11 fe d7  3c 67 b9 26  8c 70 38 f9  7f 84 11 d3  $...<g.&.p8.....       234.1.48       
  31    IN     02 99 8d a7  22 9e 0e 45  00 2d 2d 25  28 a0 03 14  ...."..E.--%(...       235.1.0        
               b4 52 d0 01  45 14 50 01  45 04 e2 8c  13 40 08 79  .R..E.P.E....@.y       235.1.16       
               e0 51 8c 1e  69 e0 62 83  cd 00 03 a7  14 b4 cc 15  .Q..i.b.........       235.1.32       
               3e d4 f0 73  40 0a 28 a2  96 80 0a 5a  28 a6 01 4a  >..s@.(....Z(..J       235.1.48       
  31    IN     40 0f a2 9a  a7 22 9d 40  05 14 51 40  0a 29 71 49  @....".@..Q@.)qI       236.1.0        
               d2 96 80 0a  28 a2 80 16  94 52 52 13  e9 40 0e 27  ....(....RR..@.'       236.1.16       
               14 dd a4 8e  29 54 77 35  20 a6 84 5c  8a 44 31 8d  ....)Tw5 ..\.D1.       236.1.32       
               a3 03 d2 a4  aa 48 4a b8  61 c7 ad 5c  52 18 02 3b  .....HJ.a..\R..;       236.1.48       
  31    IN     e5 8d 3c 0c  50 03 17 83  cd 49 4d 65  f4 a4 56 ec  ..<.P....IMe..V.       237.1.0        
               68 01 f4 51  45 00 14 b4  94 50 02 d1  45 25 30 16  h..QE....P..E%0.       237.1.16       
               8a 28 a0 05  14 b9 a6 d1  40 0f cd 49  0c c5 1c 29  .(......@..I...)       237.1.32       
               c9 43 c6 3d  ea 0c d3 58  f1 8a 60 5f  b8 b8 58 d7  .C.=...X..`_..X.       237.1.48       
  31    IN     16 8a 28 cd  00 14 51 45  00 2d 14 51  40 0d 3f 29  ..(...QE.-.Q@.?)       238.1.0        
               cd 3c 1c d1  8c d3 7e e9  a4 02 62 8c  53 b1 46 29  .<........b.S.F)       238.1.16       
               90 37 14 e1  4b 8a 00 a6  01 4a 05 28  14 e0 29 80  .7..K....J.(..).       238.1.32       
               80 52 81 4e  0b 4e 03 14  00 d0 b4 e0  85 8e 00 cd  .R.N.N..........       238.1.48       
  31    OUT    30 8e 04 00  00 00                                  0.....                 239.1.0(2)     
  31    IN     00 00 00 00                                         ....                   240.1.0(2)     
  31    OUT    30 81 0c 00  00 00                                  0.....                 241.1.0(2)     
  31    IN     00 00 00 00  14 50 03 59  73 48 ad 83               .....P.YsH..           242.1.0(2)     
  31    OUT    30 8e 04 00  00 00                                  0.....                 247.1.0        
  31    IN     0f 00 00 00                                         ....                   248.1.0        
  31    OUT    30 8f 0f 00  00 00                                  0.....                 249.1.0        
  31    IN     66 69 6e 64  20 74 69 6d  65 3d 30 2e  30 0d 0a     find time=0.0..        250.1.0        
  31    OUT    30 81 0c 00  00 00                                  0.....                 251.1.0(3)     
  31    IN     00 00 00 00  20 74 69 6d  65 3d 30 2e               .... time=0.           252.1.0(3)     
  31    OUT    30 8e 04 00  00 00                                  0.....                 253.1.0(3)     
  31    IN     00 00 00 00                                         ....                   254.1.0(3)     
  31    OUT    30 87 04 00  00 00                                  0.....                 263.1.0        
  31    IN     01 00 00 00                                         ....                   264.1.0        
  31    OUT    30 81 0c 00  00 00                                  0.....                 265.1.0        
  31    IN     40 01 00 00  f0 00 00 00  6c 0d 00 00               @.......l...           266.1.0        
  31    OUT    30 82 6c 0d  00 00                                  0.l...                 267.1.0        
  31    IN     ff d8 ff e0  00 10 4a 46  49 46 00 01  01 00 00 01  ......JFIF......       268.1.0        
               00 01 00 00  ff db 00 84  00 17 10 11  14 11 0e 17  ................       268.1.16       
               14 12 14 1a  18 17 1b 22  39 25 22 1f  1f 22 46 32  ......."9%".."F2       268.1.32       
               35 29 39 52  48 57 55 51  48 50 4e 5b  66 83 6f 5b  5)9RHWUQHPN[f.o[       268.1.48       
  31    IN     6a 73 74 75  76 77 78 79  7a 82 83 84  85 86 87 88  jstuvwxyz.......       269.1.0        
               89 8a 92 93  94 95 96 97  98 99 9a a2  a3 a4 a5 a6  ................       269.1.16       
               a7 a8 a9 aa  b2 b3 b4 b5  b6 b7 b8 b9  ba c2 c3 c4  ................       269.1.32       
               c5 c6 c7 c8  c9 ca d2 d3  d4 d5 d6 d7  d8 d9 da e2  ................       269.1.48       
  31    IN     90 c3 07 3c  fa 67 fa e2  80 ea 33 27  92 08 1e be  ...<.g....3'....       270.1.0        
               99 ee 7d e8  03 a7 07 1d  86 39 c7 61  8e d4 74 c7  .........9.a..t.       270.1.16       
               5c f4 1e b8  f4 f6 cd 28  e7 3d 3f da  e7 e5 cf 72  \......(.=?....r       270.1.32       
               4f 7a 40 1e  a7 23 fd ae  78 f7 39 a5  c7 4e 38 e3  Oz@..#..x.9..N8.       270.1.48       
  31    IN     4f 5a 78 14  b4 00 29 c8  a7 01 4c c6  0e 45 3d 4e  OZx...)...L..E=N       271.1.0        
               45 00 2d 2d  25 2d 00 14  a0 50 29 68  00 a2 8a 28  E.--%-...P)h...(       271.1.16       
               00 a2 82 71  49 82 68 00  3c f0 29 31  83 cd 48 06  ...qI.h.<.)1..H.       271.1.32       
               28 c6 68 00  1d 38 a5 a6  60 a9 f6 a7  83 9a 00 5a  (.h..8..`......Z       271.1.48       
  31    IN     35 97 b8 a5  53 9a 70 a6  b0 c1 c8 a0  07 8a 29 14  5...S.p.......).       272.1.0        
               e6 96 80 16  8a 28 a0 02  8a 29 68 00  c5 2d 20 a5  .....(...)h..- .       272.1.16       
               a0 02 96 92  90 9a 00 76  70 29 36 92  28 51 9e 4d  .......vp)6.(Q.M       272.1.32       
               48 29 81 76  29 10 c6 36  0c 76 c5 49  54 63 25 1c  H).v)..6.v.ITc%.       272.1.48       
  31    IN     14 13 8a 00  29 8d c9 e2  97 96 fa 52  81 8a 00 6a  ....)......R...j       273.1.0        
               f0 79 a7 d2  30 cd 22 9e  c6 80 1d 4b  9a 4a 5a 00  .y..0."....K.JZ.       273.1.16       
               5a 28 a2 80  0a 28 a2 80  0a 28 cd 14  00 a2 97 34  Z(...(...(.....4       273.1.32       
               da 29 80 fc  d4 90 4e 63  70 a4 92 87  8c 54 19 a6  .)....Ncp....T..       273.1.48       
  31    IN     69 00 d2 36  9c 8a 70 39  a2 9b f7 4d  00 14 53 b1  i..6..p9...M..S.       274.1.0        
               46 29 92 33  18 a7 01 4b  8a 55 18 a6  21 31 4a 05  F).3...K.U..!1J.       274.1.16       
               38 0a 50 28  01 00 a7 01  4e 0b 4a 05  30 10 2d 28  8.P(....N.J.0.-(       274.1.32       
               52 c7 0a 32  6a 44 8c bf  4e 9e b5 65  11 50 60 0f  R..2jD..N..e.P`.       274.1.48       
  31    OUT    30 8e 04 00  00 00                                  0.....                 275.1.0(2)     
  31    IN     00 00 00 00                                         ....                   276.1.0(2)     
  31    OUT    30 81 0c 00  00 00                                  0.....                 277.1.0(2)     
  31    IN     00 00 00 00  35 97 34 00  ea 29 8a dd               ....5.4..)..           278.1.0(2)     
  31    OUT    30 8e 04 00  00 00                                  0.....                 283.1.0        
  31    IN     0f 00 00 00                                         ....                   284.1.0        
  31    OUT    30 8f 0f 00  00 00                                  0.....                 285.1.0        
  31    IN     66 69 6e 64  20 74 69 6d  65 3d 30 2e  30 0d 0a     find time=0.0..        286.1.0        
  31    OUT    30 81 0c 00  00 00                                  0.....                 287.1.0(3)     
  31    IN     00 00 00 00  20 74 69 6d  65 3d 30 2e               .... time=0.           288.1.0(3)     
  31    OUT    30 8e 04 00  00 00                                  0.....                 289.1.0(3)     
  31    IN     00 00 00 00                                         ....                   290.1.0(3)     
  31    OUT    30 81 0c 00  00 00                                  0.....                 299.1.0        
  31    IN     40 01 00 00  f0 00 00 00  6b 0d 00 00               @.......k...           300.1.0        
  31    OUT    30 82 6b 0d  00 00                                  0.k...                 301.1.0        
  31    IN     ff d8 ff e0  00 10 4a 46  49 46 00 01  01 00 00 01  ......JFIF......       302.1.0        
               00 01 00 00  ff db 00 84  00 17 10 11  14 11 0e 17  ................       302.1.16       
               14 12 14 1a  18 17 1b 22  39 25 22 1f  1f 22 46 32  ......."9%".."F2       302.1.32       
               35 29 39 52  48 57 55 51  48 50 4e 5b  66 83 6f 5b  5)9RHWUQHPN[f.o[       302.1.48       
  31    IN     6a 73 74 75  76 77 78 79  7a 82 83 84  85 86 87 88  jstuvwxyz.......       303.1.0        
               89 8a 92 93  94 95 96 97  98 99 9a a2  a3 a4 a5 a6  ................       303.1.16       
               a7 a8 a9 aa  b2 b3 b4 b5  b6 b7 b8 b9  ba c2 c3 c4  ................       303.1.32       
               c5 c6 c7 c8  c9 ca d2 d3  d4 d5 d6 d7  d8 d9 da e2  ................       303.1.48       
  31    IN     7d 7d aa 93  23 29 21 80  c8 3c fa 67  fa e2 80 ea  ....#)!..<.g....       304.1.0        
               33 d4 8c 0f  5f 4c f7 3e  f8 a3 1d 38  24 76 18 e7  3..._L.>...8$v..       304.1.16       
               1d 86 3b 51  8c 11 d7 38  e3 d7 1e 9e  d9 a5 19 e7  ..;Q...8........       304.1.32       
               a7 7d dc fc  be e4 9e f4  08 3a 64 82  3b ee e7 8f  .........:d.;...       304.1.48       
  31    IN     22 9c 8a 7d  33 1b 4e 45  3c 1c 8a 00  29 68 a5 02  "...3.NE<...)h..       305.1.0        
               80 01 4b 45  14 00 52 d2  52 e2 80 0a  5e 94 84 8a  ..KE..R.R...^...       305.1.16       
               4e 4d 00 07  9e 94 98 c1  e6 9e 06 29  71 9a 00 41  NM.........)q..A       305.1.32       
               cd 3a 99 82  bf 4a 7a 90  68 01 40 a2  8a 5a 60 14  .:...Jz.h.@..Z`.       305.1.48       
  31    IN     14 00 fa 29  aa 72 29 d4  00 51 45 14  00 b4 b4 82  ...).r)..QE.....       306.1.0        
               96 80 0a 28  a2 80 16 94  52 52 13 e9  4c 07 12 05  ...(....RR..L...       306.1.16       
               37 69 34 aa  bd cd 3c 50  80 bb 14 88  63 1b 38 1d  7i4...<P....c.8.       306.1.32       
               31 52 55 28  c9 47 04 1c  7a d5 c5 21  80 23 bd 0c  1RU(.G..z..!.#..       306.1.48       
  31    IN     06 05 00 31  78 3c d4 94  d6 5c d2 2b  76 34 01 25  ...1x<...\.+v4.%       307.1.0        
               14 99 a2 80  16 8a 28 a0  02 8a 28 a0  05 a2 92 8a  ......(...(.....       307.1.16       
               00 50 69 73  4d a2 98 0f  cd 49 04 e6  37 0a 49 d8  .PisM....I..7.I.       307.1.32       
               78 c7 bd 43  4c 63 c6 28  03 42 e2 e1  63 5d aa 41  x..CLc.(.B..c].A       307.1.48       
  31    IN     87 e5 39 14  f0 73 46 33  4d fb a6 80  12 96 97 14  ..9..sF3M.......       308.1.0        
               62 99 23 71  4e 14 b8 a0  0a 00 31 4a  05 28 14 e0  b.#qN.....1J.(..       308.1.16       
               29 80 80 52  81 4e 0b 4e  00 0a 60 34  2d 28 52 c7  )..R.N.N..`4-(R.       308.1.32       
               00 66 a5 48  d9 fa 74 f5  ab 29 1a c6  30 07 e3 46  .f.H..t..)..0..F       308.1.48       
  31    OUT    30 8e 04 00  00 00                                  0.....                 309.1.0(3)     
  31    IN     00 00 00 00                                         ....                   310.1.0(3)     
  31    OUT    30 81 0c 00  00 00                                  0.....                 311.1.0(3)     
  31    IN     00 00 00 00  e6 80 1d 45  31 5b 9c 1a               .......E1[..           312.1.0(3)     
  31    OUT    30 8e 04 00  00 00                                  0.....                 321.1.0        
  31    IN     0f 00 00 00                                         ....                   322.1.0        
  31    OUT    30 8f 0f 00  00 00                                  0.....                 323.1.0        
  31    IN     66 69 6e 64  20 74 69 6d  65 3d 30 2e  30 0d 0a     find time=0.0..        324.1.0        
  31    OUT    30 81 0c 00  00 00                                  0.....                 325.1.0(3)     
  31    IN     00 00 00 00  20 74 69 6d  65 3d 30 2e               .... time=0.           326.1.0(3)     
  31    OUT    30 8e 04 00  00 00                                  0.....                 327.1.0(3)     
  31    IN     00 00 00 00                                         ....                   328.1.0(3)     
  31    OUT    30 81 0c 00  00 00                                  0.....                 337.1.0        
  31    IN     40 01 00 00  f0 00 00 00  77 0d 00 00               @.......w...           338.1.0        
  31    OUT    30 82 77 0d  00 00                                  0.w...                 339.1.0        
  31    IN     ff d8 ff e0  00 10 4a 46  49 46 00 01  01 00 00 01  ......JFIF......       340.1.0        
               00 01 00 00  ff db 00 84  00 17 10 11  14 11 0e 17  ................       340.1.16       
               14 12 14 1a  18 17 1b 22  39 25 22 1f  1f 22 46 32  ......."9%".."F2       340.1.32       
               35 29 39 52  48 57 55 51  48 50 4e 5b  66 83 6f 5b  5)9RHWUQHPN[f.o[       340.1.48       
  31    IN     6a 73 74 75  76 77 78 79  7a 82 83 84  85 86 87 88  jstuvwxyz.......       341.1.0        
               89 8a 92 93  94 95 96 97  98 99 9a a2  a3 a4 a5 a6  ................       341.1.16       
               a7 a8 a9 aa  b2 b3 b4 b5  b6 b7 b8 b9  ba c2 c3 c4  ................       341.1.32       
               c5 c6 c7 c8  c9 ca d2 d3  d4 d5 d6 d7  d8 d9 da e2  ................       341.1.48       
  31    IN     77 f6 aa 4c  8c a4 87 03  20 f3 e9 9f  eb 8a 00 67  w..L.... ......g       342.1.0        
               ae 08 1e be  99 ee 7d f1  40 03 8e 09  1d 86 39 c7  ........@.....9.       342.1.16       
               61 8e d4 b8  c6 3a fb 7a  e3 b0 f6 cd  28 ef 8c 77  a....:.z....(..w       342.1.32       
               dd 83 f2 fb  92 7b d0 80  07 19 c1 f5  dd cf 1e e4  ................       342.1.48       
  31    IN     22 9c 8a 76  29 98 c1 c8  a9 01 c8 a0  02 96 8a 50  "..v)..........P       343.1.0        
               28 00 14 b4  51 40 05 14  52 d0 01 47  d6 82 40 a4  (...Q@..R..G..@.       343.1.16       
               c1 34 00 1e  7a 52 63 69  e6 9e 06 29  71 9a 00 41  .4..zRci...)q..A       343.1.32       
               cd 2d 37 1b  4f b5 38 73  40 0b 4b 8a  29 69 80 51  .-7.O.8s@.K.)i.Q       343.1.48       
  31    IN     47 3d 69 d4  d6 5c 1c 8a  06 3a 96 91  4e 45 2d 00  G=i..\...:..NE-.       344.1.0        
               14 b4 94 b4  00 0a 5c 51  45 00 14 51  4b 40 05 28  ......\QE..QK@.(       344.1.16       
               a4 a4 2d e9  4c 07 13 8a  4d a4 8e 28  55 ee 6a 41  ..-.L...M..(U.jA       344.1.32       
               4d 08 b9 13  a3 46 36 70  3d 3d 2a 4a  a4 84 a3 02  M....F6p==*J....       344.1.48       
  31    IN     77 1e 29 79  63 4e 0b 8a  00 62 f5 e6  a4 a6 b2 fa  w.)ycN...b......       345.1.0        
               52 2b 76 34  00 fa 28 a2  80 16 8a 4a  28 01 68 a4  R+v4..(....J(.h.       345.1.16       
               a5 a6 01 45  14 50 02 83  4b 9a 6d 19  a6 03 f3 52  ...E.P..K.m....R       345.1.32       
               43 39 8d c2  92 4a 9e 31  ef 50 66 9a  c7 8c 52 02  C9...J.1.Pf...R.       345.1.48       
  31    IN     29 68 00 a2  8a 28 01 68  a2 8a 00 69  f9 4e 45 3c  )h...(.h...i.NE<       346.1.0        
               1c d1 8c d3  3e e9 a0 02  8c 53 b1 46  28 24 6e 39  ....>....S.F($n9       346.1.16       
               a7 0a 31 4a  07 6a 62 0a  50 29 40 a5  02 80 00 29  ..1J.jb.P)@....)       346.1.32       
               40 a7 05 a7  01 4c 06 81  4a 10 b1 c0  19 35 22 46  @....L..J....5"F       346.1.48       
  31    OUT    30 8e 04 00  00 00                                  0.....                 347.1.0        
  31    IN     00 00 00 00                                         ....                   348.1.0        
  31    OUT    30 87 04 00  00 00                                  0.....                 349.1.0        
  31    IN     01 00 00 00                                         ....                   350.1.0        
  31    OUT    30 81 0c 00  00 00                                  0.....                 351.1.0        
  31    IN     00 00 00 00  00 35 86 69  15 b1 c1 a7               .....5.i....           352.1.0        
  31    OUT    30 8e 04 00  00 00                                  0.....                 353.1.0        
  31    IN     00 00 00 00                                         ....                   354.1.0        
  31    OUT    30 81 0c 00  00 00                                  0.....                 355.1.0        
  31    IN     00 00 00 00  00 35 86 69  15 b1 c1 a7               .....5.i....           356.1.0        
  31    OUT    30 8e 04 00  00 00                                  0.....                 357.1.0        
  31    IN     0f 00 00 00                                         ....                   358.1.0        
  31    OUT    30 8f 0f 00  00 00                                  0.....                 359.1.0        
  31    IN     66 69 6e 64  20 74 69 6d  65 3d 30 2e  30 0d 0a     find time=0.0..        360.1.0        
  31    OUT    30 81 0c 00  00 00                                  0.....                 361.1.0(3)     
  31    IN     00 00 00 00  20 74 69 6d  65 3d 30 2e               .... time=0.           362.1.0(3)     
  31    OUT    30 8e 04 00  00 00                                  0.....                 363.1.0(3)     
  31    IN     00 00 00 00                                         ....                   364.1.0(3)     
  31    OUT    30 81 0c 00  00 00                                  0.....                 373.1.0        
  31    IN     40 01 00 00  f0 00 00 00  8c 0d 00 00               @...........           374.1.0        
  31    OUT    30 82 8c 0d  00 00                                  0.....                 375.1.0        
  31    IN     ff d8 ff e0  00 10 4a 46  49 46 00 01  01 00 00 01  ......JFIF......       376.1.0        
               00 01 00 00  ff db 00 84  00 17 10 11  14 11 0e 17  ................       376.1.16       
               14 12 14 1a  18 17 1b 22  39 25 22 1f  1f 22 46 32  ......."9%".."F2       376.1.32       
               35 29 39 52  48 57 55 51  48 50 4e 5b  66 83 6f 5b  5)9RHWUQHPN[f.o[       376.1.48       
  31    IN     6a 73 74 75  76 77 78 79  7a 82 83 84  85 86 87 88  jstuvwxyz.......       377.1.0        
               89 8a 92 93  94 95 96 97  98 99 9a a2  a3 a4 a5 a6  ................       377.1.16       
               a7 a8 a9 aa  b2 b3 b4 b5  b6 b7 b8 b9  ba c2 c3 c4  ................       377.1.32       
               c5 c6 c7 c8  c9 ca d2 d3  d4 d5 d6 d7  d8 d9 da e2  ................       377.1.48       
  31    IN     3d 3d ab 46  68 04 a0 9e  8e 3b f7 3e  d5 49 90 a9  ==.Fh....;.>.I..       378.1.0        
               21 c7 20 f3  e9 9f eb 8a  03 a8 cf 5c  63 df d3 3d  !. ........\c..=       378.1.16       
               cf bd 00 74  38 27 a6 06  39 c7 61 8e  d4 63 04 63  ...t8'..9.a..c.c       378.1.32       
               39 c7 18 1c  e3 d3 db 34  a3 bf 4f 56  e7 e5 cf 72  9......4..OV...r       378.1.48       
  31    IN     cd 34 a9 eb  4f 02 96 80  11 4e 45 3c  0a 61 18 39  .4..O....NE<.a.9       379.1.0        
               14 f5 39 14  00 b4 51 4b  40 06 29 45  03 a5 2d 00  ..9...QK@.)E..-.       379.1.16       
               14 51 45 00  14 50 4e 29  30 4d 00 07  9e 94 98 da  .QE..PN)0M......       379.1.32       
               79 a9 00 c5  04 66 80 01  d3 8a 5a 66  36 fd 29 e0  y....f....Zf6.).       379.1.48       
  31    IN     34 e0 31 45  28 e6 80 18  cb dc 53 94  e6 9d 8a 63  4.1E(.....S....c       380.1.0        
               0c 1c 8a 00  7d 14 8a 72  29 d4 00 51  45 14 00 52  .......r)..QE..R       380.1.16       
               d2 52 8a 00  5a 28 a2 80  0a 5a 4a 42  dd 85 00 38  .R..Z(...ZJB...8       380.1.32       
               9c 0a 4d a4  8a 15 73 c9  a9 05 34 05  d8 a4 43 18  ..M...s...4...C.       380.1.48       
  31    IN     a2 8a 5a 06  25 14 52 d0  01 45 14 84  e2 80 14 e0  ..Z.%.R..E......       381.1.0        
               53 1b 9e 94  72 69 ea b8  a0 08 d7 83  83 52 0c 53  S...ri.......R.S       381.1.16       
               59 73 d2 85  3d 8d 00 3e  8a 33 45 00  14 51 45 00  Ys..=..>.3E..QE.       381.1.32       
               14 b4 94 50  02 d1 49 45  30 1c 29 73  4d a2 80 1d  ...P..IE0.)sM...       381.1.48       
  31    IN     69 4b 7a 50  02 b3 50 07  73 48 07 ad  3a 98 05 2d  iKzP..P.sH..:..-       382.1.0        
               25 02 80 16  8a 4a 51 40  05 2d 25 14  00 b4 50 28  %....JQ@.-%...P(       382.1.16       
               a0 06 9f 94  e6 9c 0e 68  eb 4d fb a6  80 0a 31 4e  .......h.M....1N       382.1.32       
               c5 18 a0 91  a4 73 4e 14  b8 a0 0e d4  c4 18 a5 02  .....sN.........       382.1.48       
  31    OUT    30 8e 04 00  00 00                                  0.....                 383.1.0(3)     
  31    IN     00 00 00 00                                         ....                   384.1.0(3)     
  31    OUT    30 81 0c 00  00 00                                  0.....                 385.1.0(3)     
  31    IN     00 00 00 00  29 45 25 2d  00 7f ff d9               ....)E%-....           386.1.0(3)     
  31    OUT    30 8e 04 00  00 00                                  0.....                 395.1.0        
  31    IN     0f 00 00 00                                         ....                   396.1.0        
  31    OUT    30 8f 0f 00  00 00                                  0.....                 397.1.0        
  31    IN     66 69 6e 64  20 74 69 6d  65 3d 30 2e  30 0d 0a     find time=0.0..        398.1.0        
